{
  "$schema": "https://json-schema.org/draft/2020-12/schema",
  "type": "object",
  "additionalProperties": false,
  "required": ["schema_version", "request_id", "action", "repository", "task"],
  "properties": {
    "schema_version": {"type": "integer", "const": 1},
    "request_id": {"type": "string", "minLength": 1},
    "action": {"type": "string", "enum": ["implement", "correct"]},
    "repository": {"type": "string", "minLength": 1},
    "task": {"type": "string", "minLength": 1},
    "constraints": {"type": "array", "items": {"type": "string"}},
    "context_files": {"type": "array", "items": {"type": "string"}},
    "review_findings": {
      "type": "array",
      "items": {
        "type": "object",
        "required": ["title", "details"],
        "properties": {
          "title": {"type": "string", "minLength": 1},
          "details": {"type": "string", "minLength": 1},
          "severity": {"type": "string", "enum": ["blocking", "important", "optional"]}
        }
      }
    },
    "max_correction_cycles": {"type": "integer", "minimum": 0},
    "authorization": {
      "type": "object",
      "additionalProperties": false,
      "properties": {
        "allowed_actions": {
          "type": "array",
          "uniqueItems": true,
          "items": {
            "type": "string",
            "enum": [
              "local_mutation",
              "local_commit",
              "normal_push",
              "create_branch",
              "branch_publication",
              "draft_pr_create",
              "draft_pr_update",
              "ready_for_review",
              "merge",
              "tag",
              "release",
              "deploy",
              "force_push",
              "destructive_remote",
              "issue_state",
              "repository_settings"
            ]
          }
        }
      }
    },
    "parent_request_id": {"type": "string", "minLength": 1},
    "antigravity_conversation_id": {"type": "string", "minLength": 1, "maxLength": 500}
  }
}
