{
  "schema_version": 1,
  "request_id": "prompt-arena-package-provenance-followup-20260830",
  "parent_request_id": "prompt-arena-package-exact-head-20260830",
  "action": "implement",
  "repository": "E:\\Prompt Arena-live-telemetry-i18n-commit2",
  "task": "Required skills first: read C:\\CodexGlobal\\AGENTS.md, C:\\CodexGlobal\\skills\\ponytail\\SKILL.md (full mode), and the applicable project-phase, project-security, and project-publication instructions before editing. You are the canonical BL4/biel4 Executor only through the authenticated Dual Codex App Server/headless path. Continue the single Prompt Arena completion task in E:\\Prompt Arena-live-telemetry-i18n-commit2 on branch completion/windows-qa-live-telemetry-i18n. The current clean checkout HEAD is 21a9b5c (docs-only descendant); its production source implementation remains exactly reviewed HEAD 8588a2dd66e386082e153c933b1b55891ac42657. A previous package turn timed out before its provenance/report was captured, although it left a package commit and fresh files. Establish a new authoritative package-generation attestation without changing source code or protected worktrees: verify HEAD/source relation and clean tracked status, run npm run tauri:build -- --bundles nsis --config '{\"bundle\":{\"useLocalToolsDir\":true}}' again (incremental rebuild is intentional; do not run cargo clean or delete broad directories), then npm run package:artifacts -- --platform windows and npm run verify:package -- --platform windows --smoke. Capture exact artifact/bundle/bundled-worker/sidecar sizes and SHA-256 values, checksum manifest and package-verification hashes, and checksum/install/start/restart/silent-uninstall results. Update only checksums-sha256.txt, package-verification.txt, docs/DELIVERY_MATRIX.md, and docs/WINDOWS_NATIVE_HUMAN_QA_CHECKLIST.md if actual measurements require it; add a concise evidence line tying this fresh rebuild to checkout HEAD 21a9b5c and production source HEAD 8588a2d, and keep the allowed status vocabulary plus PENDING_HUMAN_QA, BLOCKED_EXTERNAL_RUNTIME, BLOCKED LOCALLY/MSI, Linux/remote CI and live LM Studio/llama.cpp service reservations honest. Do not claim human QA from package smoke. If hashes are unchanged, still record the new verified turn in package-verification.txt or the two docs so the attestation is materially represented. Stage only those evidence files actually changed and create one normal local commit docs: attest exact-head package provenance. Do not push, tag, release, deploy, merge, amend, rebase, reset, or use an alternate execution path. Provenance handling: the authenticated wrapper records executor account biel4, executor role, App Server transport and IDs, workspace-write, Windows sandbox elevated/readiness ready, and approval never in its result metadata; treat wrapper metadata as authoritative and do not self-block on unsupported PowerShell snapshots or protected-worktree dubious-ownership warnings. Report full captured provenance and all measurements. Only if the wrapper itself genuinely lacks a required field should you stop without a commit and report PROMPT_ARENA_BLOCKED_BY_PROVENANCE.",
  "constraints": [
    "Canonical BL4/biel4 authenticated App Server/headless Executor only; no native subagent, TUI/native_tui, fallback backend, alternate account, or danger-full-access.",
    "No source implementation/test changes and no modifications to the original, linked-source, or PR#28 protected worktrees.",
    "Incremental NSIS rebuild and package smoke only; do not run cargo clean or broad deletion; stage only evidence files that actually change.",
    "Tie every measurement to checkout HEAD 21a9b5c and production source implementation HEAD 8588a2d; retain honest native/human/external gates.",
    "Do not push, tag, release, deploy, merge, amend, rebase, or reset."
  ],
  "review_findings": [
    {"title":"Prior package generation lacked captured provenance","details":"The previous exact-head package turn timed out at the wrapper boundary before producing an executor report, so its artifact generation cannot be used as formal BL4 provenance. Rebuild and attest the package in this new turn.","severity":"blocking"},
    {"title":"Preserve package and QA boundaries","details":"Keep package smoke separate from visual/native/human QA; retain PENDING_HUMAN_QA and all Docker/MSI/Linux/remote/live-service reservations in the evidence.","severity":"important"}
  ],
  "context_files": [
    "C:\\Users\\bielx\\Downloads\\PROMPT_ARENA_WINDOWS_QA_LIVE_TELEMETRY_I18N_COMPLETION.md",
    "E:\\Prompt Arena-live-telemetry-i18n-commit2\\package.json",
    "E:\\Prompt Arena-live-telemetry-i18n-commit2\\scripts\\package-artifacts.mjs",
    "E:\\Prompt Arena-live-telemetry-i18n-commit2\\scripts\\verify-package.mjs",
    "E:\\Prompt Arena-live-telemetry-i18n-commit2\\checksums-sha256.txt",
    "E:\\Prompt Arena-live-telemetry-i18n-commit2\\package-verification.txt",
    "E:\\Prompt Arena-live-telemetry-i18n-commit2\\docs\\DELIVERY_MATRIX.md",
    "E:\\Prompt Arena-live-telemetry-i18n-commit2\\docs\\WINDOWS_NATIVE_HUMAN_QA_CHECKLIST.md",
    "E:\\Prompt Arena-live-telemetry-i18n-commit2\\src-tauri\\tauri.conf.json"
  ],
  "max_correction_cycles": 1,
  "authorization": {"allowed_actions": ["local_mutation"]}
}
