{
  "schema_version": 1,
  "request_id": "prompt-arena-p4-followup-resume-20260828",
  "parent_request_id": "prompt-arena-p4-followup-20260828",
  "action": "implement",
  "repository": "E:/Prompt Arena",
  "task": "Resume the timed-out P4 follow-up on the existing partial working-tree diff. Preserve and inspect the current changes in src-tauri/src/commands.rs, src-tauri/src/lib.rs, src-tauri/src/storage.rs, src-tauri/src/storage/migrations/0007_advanced_arena.sql, src/advanced-arena-view.tsx, src/advanced-arena.ts, and src/bridge.ts; do not discard them or unrelated user work. Finish the narrow P4 product-completion scope from the parent request: compile-safe immutable app-owned calibration benchmark/result persistence with migration and typed commands/bridge, frozen AI-judge identity/version/rubric/prompt plus official panel metadata, tournament results/standings and regression/ranking outputs using immutable Arena evidence, and usable save/reopen/disagreement UI. Preserve fail-closed validation, objective-verifier authority, blind/anonymized boundaries, no network calls, and no page-transition motion. Resolve any compile/test errors introduced by the partial diff, add focused tests, update ROADMAP honestly. Run npm typecheck/test/build, cargo fmt/check/test, and git diff --check. Commit only the completed focused P4 implementation. No push, merge, tag, release, deploy, paid-provider calls, or unrelated file changes.",
  "constraints": [
    "canonical BL4 only; account=biel4; role=Executor/Reviewer; CODEX_HOME=C:/Users/bielx/3D Objects/CodexProfiles/executor; backend=app_server; task_transport=app_server; sandbox_mode=workspace-write; windows.sandbox=elevated; readiness=ready; approval_policy=never; danger-full-access prohibited",
    "same app_server Executor session; no TUI/native_tui/fallback/substitute",
    "start from partial diff on completion/advanced-arena-followup; allow-dirty is explicitly authorized to preserve it",
    "do not revert or overwrite unrelated user changes; no generated evidence files committed"
  ],
  "authorization": {"allowed_actions": ["local_mutation", "local_commit"]},
  "context_files": [
    "C:/Users/bielx/Downloads/PROMPT_ARENA_PRODUCT_COMPLETION_AND_REAL_DESKTOP_DELIVERY.md",
    "E:/Prompt Arena/ROADMAP.md",
    "E:/Prompt Arena/src/advanced-arena.ts",
    "E:/Prompt Arena/src/advanced-arena-view.tsx",
    "E:/Prompt Arena/src/bridge.ts",
    "E:/Prompt Arena/src-tauri/src/storage.rs",
    "E:/Prompt Arena/src-tauri/src/storage/migrations/0007_advanced_arena.sql",
    "E:/Prompt Arena/src-tauri/src/commands.rs",
    "E:/Prompt Arena/src-tauri/src/lib.rs"
  ],
  "max_correction_cycles": 0
}
