{"schema_version":1,"request_id":"aip-phase12-android-duplex-counter-20260822","action":"implement","repository":"C:/Users/bielx/3D Objects/Dual-Codex-worktree/aip-phase10-checkout","task":"Fix the Android protocol interoperability bug identified after host tests. Desktop Session uses one monotonic counter for both authenticated inbound requests and signed outbound responses; Android CompanionProtocol currently tracks outbound and inbound separately but does not advance its next outbound counter after accepting a server response. In accept(), after MAC/replay validation, set the outbound counter to at least the received frame counter (maxOf(counter, f.counter)) while retaining separate nonce sets; then the next request after a desktop response counter=2 must use counter=3. Add a deterministic JVM fake server test that emulates the desktop single-counter behavior (server authenticates request, then signs response with the next counter in the same session) across multiple pair/session/history requests and asserts no replay. Preserve rotation/revocation, sessionId, bounds, no logging, private endpoint and offline behavior. Run absolute Java17/SDK/Gradle8.9 testDebugUnitTest, lintDebug, assembleDebug, SHA-256 app-debug.apk, diff check, and commit as `fix: sync phase 12 duplex counters` with clean status. No Rust/Tauri/docs/Phase13/remote/publish/native subagents/direct edits.","constraints":["Use only configured Biel4 App Server Executor in fast mode; no native subagents or alternate backend.","Do not weaken replay/authentication or reset counters except explicit key rotation.","No public listener, relay, raw secret logging, or physical-device claim."],"authorization":{"allowed_actions":["local_mutation","local_commit"]},"context_files":["C:/Users/bielx/3D Objects/Dual-Codex-worktree/aip-phase10-checkout/android/app/src/main/java/com/aip/companion/Protocol.kt","C:/Users/bielx/3D Objects/Dual-Codex-worktree/aip-phase10-checkout/android/app/src/test/java/com/aip/companion/ProtocolTest.kt"],"max_correction_cycles":0}
