{"schema_version":1,"request_id":"aip-phase12-desktop-integration-20260822","action":"implement","repository":"C:/Users/bielx/3D Objects/Dual-Codex-worktree/aip-phase10-checkout","task":"Implement the desktop/Tauri side of Phase 12 on branch feat/phase-12-android-companion. HEAD includes 8baaf67, which fixes synchronized persistent in-memory Session state across TCP reconnects and concurrent replay tests; preserve it. Add a small in-memory CompanionTransportManager/State around TransportHandle/EphemeralPairing and typed Rust status/start/stop request/result structures plus Tauri commands. Start must require explicit ownerConfirmed=true, reject temporary chat/safe mode/invalid agent-owner, default bind 127.0.0.1, permit RFC1918 only with explicit private-network confirmation, reject wildcard/public, use bounded ephemeral port, generate/consume a one-time pairing key only in memory, return raw pairing code only in the Owner/UI start result, and never log/persist it. Stop must call idempotent lifecycle shutdown; status must be redacted. Add AppState/test_state initialization and handler registration. Add concise Portuguese UI and TypeScript invoke contracts only if the existing UI architecture makes that small and type-safe. Wire the authenticated bounded JSON-line handler to real existing companion Database authority: pair invokes start_companion_pairing, session invokes connect_companion_session, reconnect invokes reconnect_companion_session, history invokes list_companion_history, queue_preview/queue_approve/queue_cancel/queue_retry invoke existing queue methods. Deserialize exact existing request structs with proof/idempotency/temporaryChat and Owner gates, reject malformed/unknown/oversized payloads and revoked/temporary requests, return bounded typed metadata-only JSON, never paths/media/secrets. If the core Handler API needs a minimal extension for authenticated response signing, preserve existing callers/tests and keep key material private to the transport runtime; responses must be fresh authenticated frames with monotonic counter/nonce. Add a real Rust integration test using temporary Database and localhost TCP client that authenticates, performs pair/session/history or queue, rejects wrong MAC/replay/temporary chat/revocation, and proves stop closes the port. Run cargo fmt/check/clippy/focused/full tests, relevant contracts/desktop tests, diff check, and leave a clean worktree. Commit all desktop changes exactly as `feat: integrate phase 12 companion transport desktop`. No Android/docs/Phase13/publish/remote/native subagents/direct edits.","constraints":["Use only configured Biel4 App Server Executor in fast mode; no native subagents or alternate backend.","No public listener, relay, telemetry, raw-secret persistence/logging, or unsafe bind fallback.","Keep existing companion fixture commands and DB security gates unchanged; use Database methods, not fabricated effects.","No remote mutation, Android/Phase13 integration, release claim, or publish."],"authorization":{"allowed_actions":["local_mutation","local_commit"]},"context_files":["C:/Users/bielx/3D Objects/Dual-Codex-worktree/aip-phase10-checkout/apps/desktop/src-tauri/src/companion_transport.rs","C:/Users/bielx/3D Objects/Dual-Codex-worktree/aip-phase10-checkout/apps/desktop/src-tauri/src/companion.rs","C:/Users/bielx/3D Objects/Dual-Codex-worktree/aip-phase10-checkout/apps/desktop/src-tauri/src/database.rs","C:/Users/bielx/3D Objects/Dual-Codex-worktree/aip-phase10-checkout/apps/desktop/src-tauri/src/lib.rs","C:/Users/bielx/3D Objects/Dual-Codex-worktree/aip-phase10-checkout/packages/contracts/src/index.ts","C:/Users/bielx/3D Objects/Dual-Codex-worktree/aip-phase10-checkout/apps/desktop/src/App.tsx"],"max_correction_cycles":0}
